{
  "$schema": "http://json-schema.org/draft-07/schema#",
  "title": "Titan",
  "description": "Unique Class-Ultimate entity.",
  "type": "object",
  "required": [
    "entity_id",
    "name",
    "category",
    "magic_school",
    "changelog",
    "last_modified",
    "tags"
  ],
  "properties": {
    "$schema": { "type": "string" },
    "last_modified": { "type": "string", "format": "date-time" },
    "changelog": { "$ref": "common.schema.json#/definitions/changelog" },
    "entity_id": { "type": "string" },
    "name": { "type": "string" },
    "image_required": { "$ref": "common.schema.json#/definitions/image_required" },
    "category": {
      "type": "string",
      "enum": ["Titan"]
    },
    "magic_school": { "$ref": "common.schema.json#/definitions/magic_school" },
    "description": { "type": "string" },
    "tags": {
      "type": "array",
      "items": { "type": "string" }
    },
    "rank": { "$ref": "common.schema.json#/definitions/rank" },
    "health": { "type": "integer", "minimum": 0 },
    "damage": { "type": "integer", "minimum": 0 },
    "dps": { "type": "number", "minimum": 0 },
    "attack_interval": { "type": "number", "minimum": 0 },
    "movement_speed": { "type": "integer", "minimum": 0 },
    "range": { "type": "integer", "minimum": 0 },
    "passive_health_regen": { "type": "integer", "minimum": 0 },
    "heal_amount": { "type": "integer", "minimum": 0 },
    "mechanics": {
      "type": "object",
      "properties": {
        "auto_capture_altars": { "type": "boolean" },
        "aura": { "$ref": "common.schema.json#/definitions/aura" },
        "damage_modifiers": { "$ref": "common.schema.json#/definitions/damage_modifiers" },
        "features": { "$ref": "common.schema.json#/definitions/features" }
      },
      "additionalProperties": false
    }
  },
  "additionalProperties": false
}
