{
  "entity_id": "thanatos",
  "name": "Thanatos",
  "category": "Titan",
  "magic_school": "Titan",
  "rank": "V",
  "description": "The Titan of Death. Weakens all nearby enemies and retaliates against Spellcasters.",
  "image_required": true,
  "last_modified": "2026-02-08T14:59:13.832063+00:00",
  "tags": [],
  "changelog": [
    {
      "version": "0.0.1",
      "date": "2026-02-08T09:49:16.848821+00:00",
      "description": "Initial Closed Beta 2 Data"
    }
  ],
  "mechanics": {
    "aura": [
      {
        "name": "Aura of Decay",
        "description": "Reduces damage of nearby spellcasters.",
        "radius": 15,
        "value": 0.5,
        "interval": 1.0,
        "effect": "Debuff",
        "target_type": "Enemy"
      }
    ]
  },
  "damage": 125,
  "health": 15000,
  "movement_speed": 4
}
