[
  {
    "entity_id": "gaia_beast",
    "name": "Gaia Beast",
    "category": "Titan",
    "magic_school": "Titan",
    "rank": "V",
    "description": "The Wild Titan. Crushes all structures as it marches toward the Lifestones. Destroys and captures altars instantly.",
    "image_required": true,
    "last_modified": "2026-02-08T14:59:13.831661+00:00",
    "tags": [],
    "changelog": [
      {
        "version": "0.0.1",
        "date": "2026-02-08T09:49:16.848523+00:00",
        "description": "Initial Closed Beta 2 Data"
      }
    ],
    "mechanics": {
      "aura": [
        {
          "name": "Thorn Retaliation",
          "description": "Retaliates against Spellcasters after receiving >4000 damage.",
          "radius": 100,
          "value": 0,
          "interval": 0,
          "effect": "Damage",
          "target_type": "Enemy"
        }
      ]
    },
    "damage": 100,
    "health": 20000,
    "movement_speed": 4,
    "passive_health_regen": 50,
    "heal_amount": 0
  },
  {
    "entity_id": "thanatos",
    "name": "Thanatos",
    "category": "Titan",
    "magic_school": "Titan",
    "rank": "V",
    "description": "The Titan of Death. Weakens all nearby enemies and retaliates against Spellcasters.",
    "image_required": true,
    "last_modified": "2026-02-08T14:59:13.832063+00:00",
    "tags": [],
    "changelog": [
      {
        "version": "0.0.1",
        "date": "2026-02-08T09:49:16.848821+00:00",
        "description": "Initial Closed Beta 2 Data"
      }
    ],
    "mechanics": {
      "aura": [
        {
          "name": "Aura of Decay",
          "description": "Reduces damage of nearby spellcasters.",
          "radius": 15,
          "value": 0.5,
          "interval": 1.0,
          "effect": "Debuff",
          "target_type": "Enemy"
        }
      ]
    },
    "damage": 125,
    "health": 15000,
    "movement_speed": 4
  }
]